<?xml version="1.0" encoding="UTF-8"?>
<avlsup xmlns:avlmdk="http://www.arkivverket.no/standarder/nha/avlxml/avlxml-mdk"
 xmlns:supmdk="http://www.arkivverket.no/standarder/nha/avlxml/avlsup-mdk"
 xmlns="http://www.arkivverket.no/standarder/nha/avlxml/avlsup"
 xmlns:xsi="http://www.w3.org/2001/XMLSchema-instance"
 xsi:schemaLocation="http://www.arkivverket.no/standarder/nha/avlxml/avlsup file:/C:/Users/areant/work/avlxml/avlsup.xsd">
    <dokument>
        <dokumentidentifikator>dokumentidentifikator0</dokumentidentifikator>
        <journalidentifikator>journalidentifikator0</journalidentifikator>
        <filsti>filsti0</filsti>
        <dokumenttype>
            <dokumenttypeKode>dokumenttypeKode0</dokumenttypeKode>
            <dokumenttypeTekst>dokumenttypeTekst0</dokumenttypeTekst>
            <dokumenttypeKodeverk>dokumenttypeKodeverk0</dokumenttypeKodeverk>
        </dokumenttype>
        <dokumentdato>1800</dokumentdato>
        <Organisasjon>
            <organisasjonNummer>000000000</organisasjonNummer>
            <organisasjonNavn>organisasjonNavn0</organisasjonNavn>
        </Organisasjon>
        <Organisasjon>
            <organisasjonNummer>000000000</organisasjonNummer>
            <organisasjonNavn>organisasjonNavn1</organisasjonNavn>
        </Organisasjon>
        <episode>
            <episodeId>episodeId0</episodeId>
            <episodeStartdato>1800</episodeStartdato>
            <episodeSluttdato>1800</episodeSluttdato>
            <omsorgsniva>
                <omsorgsnivaKode>omsorgsnivaKode0</omsorgsnivaKode>
                <omsorgsnivaKodetekst>omsorgsnivaKodetekst0</omsorgsnivaKodetekst>
                <omsorgsnivaKodeverk>omsorgsnivaKodeverk0</omsorgsnivaKodeverk>
            </omsorgsniva>
            <fagomrade>
                <fagomradeKode>fagomradeKode0</fagomradeKode>
                <fagomradeKodetekst>fagomradeKodetekst0</fagomradeKodetekst>
                <fagomradeKodeverk>fagomradeKodeverk0</fagomradeKodeverk>
            </fagomrade>
        </episode>
        <diagnose>
            <diagnosedato>1800</diagnosedato>
            <diagnosekode>diagnosekode0</diagnosekode>
            <diagnosetekst>diagnosetekst0</diagnosetekst>
            <diagnosekodeverk>0</diagnosekodeverk>
        </diagnose>
        <diagnose>
            <diagnosedato>1800</diagnosedato>
            <diagnosekode>diagnosekode1</diagnosekode>
            <diagnosetekst>diagnosetekst1</diagnosetekst>
            <diagnosekodeverk>0</diagnosekodeverk>
        </diagnose>
        <prosedyre>
            <prosedyreKode>prosedyreKode0</prosedyreKode>
            <prosedyreKodetekst>prosedyreKodetekst0</prosedyreKodetekst>
            <prosedyreKodeverk>prosedyreKodeverk0</prosedyreKodeverk>
            <prosedyreDato>1800</prosedyreDato>
        </prosedyre>
        <prosedyre>
            <prosedyreKode>prosedyreKode1</prosedyreKode>
            <prosedyreKodetekst>prosedyreKodetekst1</prosedyreKodetekst>
            <prosedyreKodeverk>prosedyreKodeverk1</prosedyreKodeverk>
            <prosedyreDato>1800</prosedyreDato>
        </prosedyre>
        <henvisningsperiode>
            <henvisningsperiodeId>henvisningsperiodeId0</henvisningsperiodeId>
            <henvisningspeirodeStartdato>1800</henvisningspeirodeStartdato>
            <henvisningspeirodeSluttdato>1800</henvisningspeirodeSluttdato>
        </henvisningsperiode>
        <behandlendeAvdeling>
            <behandlendeAvdelingReshId>behandlendeAvdelingReshId0</behandlendeAvdelingReshId>
            <behandlendeavdelingNavn>behandlendeavdelingNavn0</behandlendeavdelingNavn>
        </behandlendeAvdeling>
        <saksnummer>saksnummer0</saksnummer>
    </dokument>
    <dokument>
        <dokumentidentifikator>dokumentidentifikator1</dokumentidentifikator>
        <journalidentifikator>journalidentifikator1</journalidentifikator>
        <filsti>filsti1</filsti>
        <dokumenttype>
            <dokumenttypeKode>dokumenttypeKode1</dokumenttypeKode>
            <dokumenttypeTekst>dokumenttypeTekst1</dokumenttypeTekst>
            <dokumenttypeKodeverk>dokumenttypeKodeverk1</dokumenttypeKodeverk>
        </dokumenttype>
        <dokumentdato>1800</dokumentdato>
        <Organisasjon>
            <organisasjonNummer>000000000</organisasjonNummer>
            <organisasjonNavn>organisasjonNavn2</organisasjonNavn>
        </Organisasjon>
        <Organisasjon>
            <organisasjonNummer>000000000</organisasjonNummer>
            <organisasjonNavn>organisasjonNavn3</organisasjonNavn>
        </Organisasjon>
        <episode>
            <episodeId>episodeId1</episodeId>
            <episodeStartdato>1800</episodeStartdato>
            <episodeSluttdato>1800</episodeSluttdato>
            <omsorgsniva>
                <omsorgsnivaKode>omsorgsnivaKode1</omsorgsnivaKode>
                <omsorgsnivaKodetekst>omsorgsnivaKodetekst1</omsorgsnivaKodetekst>
                <omsorgsnivaKodeverk>omsorgsnivaKodeverk1</omsorgsnivaKodeverk>
            </omsorgsniva>
            <fagomrade>
                <fagomradeKode>fagomradeKode1</fagomradeKode>
                <fagomradeKodetekst>fagomradeKodetekst1</fagomradeKodetekst>
                <fagomradeKodeverk>fagomradeKodeverk1</fagomradeKodeverk>
            </fagomrade>
        </episode>
        <diagnose>
            <diagnosedato>1800</diagnosedato>
            <diagnosekode>diagnosekode2</diagnosekode>
            <diagnosetekst>diagnosetekst2</diagnosetekst>
            <diagnosekodeverk>0</diagnosekodeverk>
        </diagnose>
        <diagnose>
            <diagnosedato>1800</diagnosedato>
            <diagnosekode>diagnosekode3</diagnosekode>
            <diagnosetekst>diagnosetekst3</diagnosetekst>
            <diagnosekodeverk>0</diagnosekodeverk>
        </diagnose>
        <prosedyre>
            <prosedyreKode>prosedyreKode2</prosedyreKode>
            <prosedyreKodetekst>prosedyreKodetekst2</prosedyreKodetekst>
            <prosedyreKodeverk>prosedyreKodeverk2</prosedyreKodeverk>
            <prosedyreDato>1800</prosedyreDato>
        </prosedyre>
        <prosedyre>
            <prosedyreKode>prosedyreKode3</prosedyreKode>
            <prosedyreKodetekst>prosedyreKodetekst3</prosedyreKodetekst>
            <prosedyreKodeverk>prosedyreKodeverk3</prosedyreKodeverk>
            <prosedyreDato>1800</prosedyreDato>
        </prosedyre>
        <henvisningsperiode>
            <henvisningsperiodeId>henvisningsperiodeId1</henvisningsperiodeId>
            <henvisningspeirodeStartdato>1800</henvisningspeirodeStartdato>
            <henvisningspeirodeSluttdato>1800</henvisningspeirodeSluttdato>
        </henvisningsperiode>
        <behandlendeAvdeling>
            <behandlendeAvdelingReshId>behandlendeAvdelingReshId1</behandlendeAvdelingReshId>
            <behandlendeavdelingNavn>behandlendeavdelingNavn1</behandlendeavdelingNavn>
        </behandlendeAvdeling>
        <saksnummer>saksnummer1</saksnummer>
    </dokument>
</avlsup>
