<?xml version="1.0" encoding="UTF-8"?>
<avlsup xmlns:avlmdk="http://www.arkivverket.no/standarder/nha/avlxml/avlxml-mdk"
 xmlns:supmdk="http://www.arkivverket.no/standarder/nha/avlxml/avlsup-mdk"
 xmlns="http://www.arkivverket.no/standarder/nha/avlxml/avlsup"
 xmlns:xsi="http://www.w3.org/2001/XMLSchema-instance"
 xsi:schemaLocation="http://www.arkivverket.no/standarder/nha/avlxml/avlsup file:/C:/Users/areant/work/avlxml/avlsup.xsd">
    <dokument>
        <dokumentidentifikator>H78JTcx65B._2y7U</dokumentidentifikator>
        <journalidentifikator>S6eXzRVtdz1UPf2.AcA</journalidentifikator>
        <filsti>zZC0srmHso65t42tvXqA1YmI</filsti>
        <dokumenttype>
            <dokumenttypeKode>OYlwcC7ZHAGA4Szgb-VSuK_7X2</dokumenttypeKode>
            <dokumenttypeTekst>rI.MxjapjC</dokumenttypeTekst>
            <dokumenttypeKodeverk>ZN</dokumenttypeKodeverk>
        </dokumenttype>
        <dokumentdato>20721025</dokumentdato>
        <Organisasjon>
            <organisasjonNummer>633917991</organisasjonNummer>
            <organisasjonNavn>CC0TX9T-ogmtOxP8xud-HJpAvL</organisasjonNavn>
        </Organisasjon>
        <Organisasjon>
            <organisasjonNummer>858468311</organisasjonNummer>
            <organisasjonNavn>E3aJCjdgGqS</organisasjonNavn>
        </Organisasjon>
        <episode>
            <episodeId>EhDMcxjgfE</episodeId>
            <episodeStartdato>1930</episodeStartdato>
            <episodeSluttdato>1924-07</episodeSluttdato>
            <omsorgsniva>
                <omsorgsnivaKode>mlHNab956X6_YWA2</omsorgsnivaKode>
                <omsorgsnivaKodetekst>w1Vt_hl</omsorgsnivaKodetekst>
                <omsorgsnivaKodeverk>FwxsDtmrPKuRImK6DvrKSpUFgy</omsorgsnivaKodeverk>
            </omsorgsniva>
            <fagomrade>
                <fagomradeKode>lSuAJZ8dEGH_an49U7-cuq</fagomradeKode>
                <fagomradeKodetekst>GHWo7uTNPmyV</fagomradeKodetekst>
                <fagomradeKodeverk>y5AwV52v9j7fYWPkVNNAZ</fagomradeKodeverk>
            </fagomrade>
        </episode>
        <diagnose>
            <diagnosedato>18411209</diagnosedato>
            <diagnosekode>OulowQBVb2KSEg</diagnosekode>
            <diagnosetekst>u54</diagnosetekst>
            <diagnosekodeverk>0</diagnosekodeverk>
        </diagnose>
        <diagnose>
            <diagnosedato>20880130</diagnosedato>
            <diagnosekode>LRyOVixMaTjkwQGMKQX</diagnosekode>
            <diagnosetekst>seCiN</diagnosetekst>
            <diagnosekodeverk>7a5o7</diagnosekodeverk>
        </diagnose>
        <prosedyre>
            <prosedyreKode>DQxZz4eSWEkhdVuQ</prosedyreKode>
            <prosedyreKodetekst>zogGDCQv8.SR_</prosedyreKodetekst>
            <prosedyreKodeverk>E8O8R4</prosedyreKodeverk>
            <prosedyreDato>2030-10-03</prosedyreDato>
        </prosedyre>
        <prosedyre>
            <prosedyreKode>IJa31pOClW</prosedyreKode>
            <prosedyreKodetekst>z8CAbhFLGkuEV</prosedyreKodetekst>
            <prosedyreKodeverk>oTS_MzmMKUzWf9z7-0EKKQ.6rji.Ma</prosedyreKodeverk>
            <prosedyreDato>20750910</prosedyreDato>
        </prosedyre>
        <henvisningsperiode>
            <henvisningsperiodeId>KQZBBC-_</henvisningsperiodeId>
            <henvisningspeirodeStartdato>2011</henvisningspeirodeStartdato>
            <henvisningspeirodeSluttdato>20850422</henvisningspeirodeSluttdato>
        </henvisningsperiode>
        <behandlendeAvdeling>
            <behandlendeAvdelingReshId>vZVBhQnT1eDWTG6UUme</behandlendeAvdelingReshId>
            <behandlendeavdelingNavn>uE6TPUUne3qk</behandlendeavdelingNavn>
        </behandlendeAvdeling>
        <saksnummer>DjZWjZHcf</saksnummer>
    </dokument>
    <dokument>
        <dokumentidentifikator>chqTsT</dokumentidentifikator>
        <journalidentifikator>cGTNWz3aJnIOUgrDN</journalidentifikator>
        <filsti>gH9QClBBEYHNAf</filsti>
        <dokumenttype>
            <dokumenttypeKode>M961Q</dokumenttypeKode>
            <dokumenttypeTekst>YxdB.388ibJWl-D03L</dokumenttypeTekst>
            <dokumenttypeKodeverk>ChWm</dokumenttypeKodeverk>
        </dokumenttype>
        <dokumentdato>2072-06</dokumentdato>
        <Organisasjon>
            <organisasjonNummer>217463014</organisasjonNummer>
            <organisasjonNavn>s68JW2vY_fwly</organisasjonNavn>
        </Organisasjon>
        <Organisasjon>
            <organisasjonNummer>962361855</organisasjonNummer>
            <organisasjonNavn>zqWoEFPquxHv</organisasjonNavn>
        </Organisasjon>
        <episode>
            <episodeId>_Neh-4bacl4</episodeId>
            <episodeStartdato>19140925</episodeStartdato>
            <episodeSluttdato>20111124</episodeSluttdato>
            <omsorgsniva>
                <omsorgsnivaKode>hg1PsaS3NDV.RnhJ</omsorgsnivaKode>
                <omsorgsnivaKodetekst>LC7LdhgQsR</omsorgsnivaKodetekst>
                <omsorgsnivaKodeverk>GS9RAFO2GHi1KW4Bu378Eczh</omsorgsnivaKodeverk>
            </omsorgsniva>
            <fagomrade>
                <fagomradeKode>ums6fXfSTlKKm</fagomradeKode>
                <fagomradeKodetekst>u8eXKABquG1ueXwEspUy77TolC9</fagomradeKodetekst>
                <fagomradeKodeverk>IL7ejx9xZ</fagomradeKodeverk>
            </fagomrade>
        </episode>
        <diagnose>
            <diagnosedato>20660308</diagnosedato>
            <diagnosekode>avgGbtZroAc</diagnosekode>
            <diagnosetekst>rZ2FJAF</diagnosetekst>
            <diagnosekodeverk>186a3</diagnosekodeverk>
        </diagnose>
        <diagnose>
            <diagnosedato>2002</diagnosedato>
            <diagnosekode>Qr6B9</diagnosekode>
            <diagnosetekst>xea8IHWmeeoP</diagnosetekst>
            <diagnosekodeverk>0j9a4x2</diagnosekodeverk>
        </diagnose>
        <prosedyre>
            <prosedyreKode>sK3MnlIG_yuns-t</prosedyreKode>
            <prosedyreKodetekst>Jpf-IXWjH7R</prosedyreKodetekst>
            <prosedyreKodeverk>n333IYvq1JUdliNcjvMUMAFQsTQ</prosedyreKodeverk>
            <prosedyreDato>2035</prosedyreDato>
        </prosedyre>
        <prosedyre>
            <prosedyreKode>ClIzUyfG2JNrTLGMh</prosedyreKode>
            <prosedyreKodetekst>HTfpbI65</prosedyreKodetekst>
            <prosedyreKodeverk>kkl1kO-FHRFbR3X4EtP</prosedyreKodeverk>
            <prosedyreDato>19060830</prosedyreDato>
        </prosedyre>
        <henvisningsperiode>
            <henvisningsperiodeId>RyGU-UqsQc2UiGbRS6vV</henvisningsperiodeId>
            <henvisningspeirodeStartdato>20390530</henvisningspeirodeStartdato>
            <henvisningspeirodeSluttdato>1906</henvisningspeirodeSluttdato>
        </henvisningsperiode>
        <behandlendeAvdeling>
            <behandlendeAvdelingReshId>A81qfgX.8b</behandlendeAvdelingReshId>
            <behandlendeavdelingNavn>_B8bl4n47s4dKVG_qn1</behandlendeavdelingNavn>
        </behandlendeAvdeling>
        <saksnummer>HauJ.TUVUWw2YdO1.m</saksnummer>
    </dokument>
</avlsup>
